Nama,Usia,Jenis Kelamin,Asal,1. Aktif lari rutin?,2. Alasan mulai lari?,3. Tergabung komunitas lari?,4. Pengaruh media sosial?,5. Hal disukai dari running cult?,6. Seberapa sering share di medsos?,7. Lari sebagai gaya hidup atau olahraga?,8. Pernah FOMO karena medsos lari?,9. Dampak tren running cult?,10. Kemungkinan ikut race?
Raka,23,Laki-laki,"Jakarta, DKI Jakarta",Ya,Ingin hidup sehat,"Ya, aktif",Cukup besar,"Dukungan komunitas, Event-event lari dan medali",Kadang-kadang,Keduanya seimbang,Kadang-kadang,Positif,Pasti ikut
Kezia,21,Perempuan,"Bandung, Jawa Barat",Tidak,Fokus ke studi,Tidak,Tidak berpengaruh,"Gaya hidup stylish, Motivasi dari media sosial",Tidak pernah,Lebih ke gaya hidup,Sering,Campur (positif & negatif),Tidak tertarik
Adit,25,Non-biner,"Surabaya, Jawa Timur",Ya,Ingin menurunkan berat badan,"Ya, tapi jarang ikut kegiatan",Sangat besar,"Outfit stylish, Pencapaian pribadi",Setiap kali lari,Lebih ke gaya hidup,Sering,Negatif,"Pernah ikut, tapi tidak mau lagi"
Fajar,19,Laki-laki,"Medan, Sumatera Utara","Pernah, tapi sudah berhenti",Ikut-ikutan teman/komunitas,Tidak,Sedikit,"Medali finisher, Motivasi media sosial",Jarang,Keduanya seimbang,Jarang,Positif,Mungkin ikut
Nabila,24,Perempuan,"Yogyakarta, DI Yogyakarta",Ya,Tren media sosial,"Ya, aktif",Sangat besar,"Outfit stylish, Konten medsos",Setiap kali lari,Lebih ke gaya hidup,Sering,Campur (positif & negatif),Pasti ikut
